{
  "slug": "blue-staffy-puppies-london",
  "session_open": {
    "ran_on": "2026-09-30",
    "skills": [
      "grill-me",
      "superpowers:writing-plans",
      "bsuk-location-page-builder"
    ]
  },
  "impeccable": {
    "ran_on": "2026-10-05",
    "widths": [
      375,
      768,
      1280
    ],
    "findings": 5,
    "fixed": 2,
    "deferred": [
      "D1 (P3 anti-pattern): CityChapters .close CTA card carries a 3px brass side rule (detector side-tab rows 1-4); CTA-1 is the breeder's pick (2026-10-04 q09 a), so a 1px steel-300 hairline is a preview, docs/reports/london-harden-2026-10-05/IMP-D1-close-rule-{375,1280}-preview.png (working rule 6)",
      "D2 (P3 type): the clause after each CTA pill opens with its comma (a line starting ', and' on a phone, a stray mark after the pill from 768); hiding it changes what a reader sees of the board's sentence, preview docs/reports/london-harden-2026-10-05/IMP-D2-close-comma-{375,768,1280}-preview.png",
      "D3 (P2 type): reading text at 13px on a phone (seven statement notes, the puppy cards' trust lines and delivery line); 14px below 640px is a type-size change to approved kit pieces (q02, CARD-3), preview docs/reports/london-harden-2026-10-05/IMP-D3-phone-notes-{stmt,card}-375-preview.png"
    ],
    "commit": "7b76daf883ab799b4866cfd03c1cc414aebaed7e"
  },
  "frontend_design": {
    "ran_on": "2026-10-03",
    "widths": [
      375,
      768,
      1280
    ],
    "findings": 10,
    "fixed": 5,
    "deferred": [
      "D5 (P3 motif): sixteen identical seal dividers at one 154px cadence; a hairline between chapter bands is a motif change, preview docs/reports/frontend-design-london/D5-divider-cadence-{375,1280}-preview.png (working rule 6)",
      "D6 (P3 motion): no page-load moment; proposed filmstrip settle-in (opacity + 8px rise, 200ms, 60ms stagger, reduced-motion off) is a new motion moment, frames docs/reports/frontend-design-london/D6-hero-settle-{375,1280}-t*.png",
      "D7 (P2 spacing): chapter tray 12px side inset vs siblings 16/32px; applying it pushed kc-registered-staffy-puppies.webp (500px, no siblings) to 2.05x at 1280 (img-srcset-within-2x), needs a width sibling at the image step first; preview docs/reports/frontend-design-london/D7-tray-gutter-{375,768,1280}-preview.png",
      "D8 (P2 image): two crops cut baked lettering (Contact Us graphic, Staffordshire/American Bully labels); crop box and focus are the board's image slots (Asset Gate); preview docs/reports/frontend-design-london/D8-crop-*-preview.png",
      "D9 (P3 chrome): footer legal row baselines 11-12px apart and the contact form kit's privacy link has no hover; shared by every page / four pages, previewed first; preview docs/reports/frontend-design-london/D9-footer-legal-{375,1280}-preview.png"
    ],
    "commit": "e7181a6a912ad081aab78cfa4802c8621b453580"
  },
  "verification_before_completion": {
    "ran_on": "2026-10-05",
    "commit": "37f2598e5a0576f51ab06fe4bdc54e831fefee41",
    "commands": [
      {
        "cmd": "npm run -s build",
        "exit": 0,
        "examined": null
      },
      {
        "cmd": "npm run -s check:all",
        "exit": 0,
        "examined": 27
      },
      {
        "cmd": "npm run gate:page -- blue-staffy-puppies-london --skip-record",
        "exit": 0,
        "examined": null
      }
    ],
    "claims_verified": [
      "London is ready for the breeder's final approval: built, every check:all gate green, and every gate:page step passes twice with identical runs on the committed page"
    ]
  }
}
